{
  "log_id": "dddddddd-dddd-4ddd-8ddd-dddddddddddd",
  "log_timestamp": "2025-10-13T12:09:00Z",
  "model": "gpt-4o-mini",
  "prompt": {
    "prompt_id": "eeeeeeee-eeee-4eee-8eee-eeeeeeeeeeee",
    "input_tokens": 15,
    "prompt_text": "[SUMMARY: brief info request]"
  },
  "result": {
    "result_id": "ffffffff-ffff-4fff-8fff-ffffffffffff",
    "response_text": "[SUMMARY: concise info returned]",
    "output_tokens": 28,
    "latency_ms": 620
  }
}
