{
  "log_id": "77777777-7777-4777-8777-777777777777",
  "log_timestamp": "2025-10-13T12:07:10Z",
  "model": "gpt-4o",
  "prompt": {
    "prompt_id": "88888888-8888-4888-8888-888888888888",
    "input_tokens": 30,
    "prompt_text": "[REDACTED: flagged content removed]"
  },
  "result": {
    "result_id": "99999999-9999-4999-8999-999999999999",
    "response_text": "[REDACTED: blocked by content filter]",
    "output_tokens": 0,
    "latency_ms": 500,
    "finish_reason": "content_filter",
    "safety_flags": ["toxicity"]
  }
}
