{
  "log_id": "log-005",
  "log_timestamp": "2025-10-07T12:04:00Z",
  "model": "gpt-5-mini",
  "prompt": {
    "prompt_id": "prompt-005",
    "input_tokens": 8,
    "prompt_text": "List three vegetables."
  },
  "result": {
    "result_id": "result-005",
    "response_text": "Spinach, bok choy, lettuce.",
    "output_tokens": 5,
    "latency_ms": 80,
    "finish_reason": "stop"
  }
}