{
  "log_id": "f9c7c7ff-9fb0-4c9e-bf33-0b0cf8a8b6a1",
  "log_timestamp": "2025-10-13T12:01:40Z",
  "model": "gpt-4o",
  "prompt": {
    "prompt_id": "36b1a7dd-7c2d-4e97-9a2d-0123456789ab",
    "input_tokens": 10,
    "prompt_text": "[REDACTED: query summarized]"
  },
  "result": {
    "result_id": "f4d85b79-9c98-4f2e-8b55-abcdefabcdef",
    "response_text": "[PENDING: generated later]",
    "output_tokens": 0,
    "latency_ms": 0
  }
}
