{
  "log_id": "log-007",
  "log_timestamp": "2025-10-07T12:06:00Z",
  "model": "deepseek-r1",
  "prompt": {
    "prompt_id": "prompt-007",
    "input_tokens": 25,
    "prompt_text": "Give me a prime number."
  },
  "result": {
    "result_id": "result-007",
    "response_text": "Seven is a prime number",
    "output_tokens": 9,
    "latency_ms": 220,
    "finish_reason": "stop"
  }
}