{
  "log_id": "aaaaaaa1-aaaa-4aaa-8aaa-aaaaaaaaaaa1",
  "log_timestamp": "2025-10-13T12:08:00Z",
  "model": "gpt-4o",
  "prompt": {
    "prompt_id": "bbbbbbb2-bbbb-4bbb-8bbb-bbbbbbbbbbb2",
    "input_tokens": 52,
    "prompt_text": "[SUMMARY: requested tool invocation]",
    "parameters": {"temperature": 0.2}
  },
  "result": {
    "result_id": "ccccccc3-cccc-4ccc-8ccc-ccccccccccc3",
    "response_text": "[SUMMARY: tool call proposed]",
    "output_tokens": 40,
    "latency_ms": 1200,
    "finish_reason": "tool_calls"
  }
}
