{
  "log_id": "log-010",
  "log_timestamp": "2025-10-07T12:09:00Z",
  "model": "gemini-2",
  "prompt": {
    "prompt_id": "prompt-010",
    "input_tokens": 18,
    "prompt_text": "List a few programming languages.",
    "parameters": {
      "temperature": 0.3
    }
  },
  "result": {
    "result_id": "result-010",
    "response_text": "Python, JavaScript, C++",
    "output_tokens": 5,
    "latency_ms": 110,
    "finish_reason": "stop"
  }
}
