{
  "log_id": "2fb979e0-6f6a-4e2b-bc9b-8f1a4d8d28b9",
  "log_timestamp": "2025-10-13T12:01:22Z",
  "model": "gpt-4o-mini",
  "prompt": {
    "prompt_id": "7a3a3b2a-5f5b-4f8f-9c9f-0123456789ab",
    "input_tokens": 18,
    "prompt_text": "[REDACTED: PII removed; user greeting summarized]",
    "parameters": {"temperature": 0.4, "top_p": 0.9, "max_tokens": 256}
  },
  "result": {
    "result_id": "e8f2a1f7-1a0b-4d1b-8f3a-abcdefabcdef",
    "response_text": "[SUMMARY: Assistant greeting generated]",
    "output_tokens": 32,
    "latency_ms": 1430
  }
}
