{
  "log_id": "log-003",
  "log_timestamp": "2025-10-07T12:02:00Z",
  "model": "claude-3-opus",
  "prompt": {
    "prompt_id": "prompt-003",
    "input_tokens": 15,
    "prompt_text": "Explain physics."
  },
  "result": {
    "result_id": "result-003",
    "response_text": "Physics is the study of matter and its motion.",
    "output_tokens": 7,
    "latency_ms": 150,
    "finish_reason": "length"
  }
}