{
  "log_id": "log-006",
  "log_timestamp": "2025-10-07T12:05:00Z",
  "model": "gpt-4",
  "prompt": {
    "prompt_id": "prompt-006",
    "input_tokens": 12,
    "prompt_text": "Name a poet.",
    "parameters": {
      "temperature": 1.0,
      "max_tokens": 60
    }
  },
  "result": {
    "result_id": "result-006",
    "response_text": "Robert Frost.",
    "output_tokens": 10,
    "latency_ms": 300,
    "finish_reason": "stop"
  }
}